{
  "tacId": "TAC-001",
  "prdId": "PRD-001",
  "tadId": "TAD-001",
  "version": "0.1.0",
  "status": "draft",
  "name": "Editor",
  "purpose": "Browser-resident markdown editor.",
  "responsibilities": [
    "Render markdown",
    "Capture user edits"
  ],
  "createdAt": "2026-01-01T00:00:00Z",
  "updatedAt": "2026-01-01T00:00:00Z"
}
